7017;ROU;IAS;POL;F;Inc2;EduF2;EduM2;(5) Glo;Nb_Vis_1a4;Mixit_N;2lang;Vecu_etra_N;multiculturalism globalization tradition  
7018;ROU;IAS;POL;F;Inc2;EduF3;EduM3;(3) Nat;Nb_Vis_O;Mixit_N;3lang;Vecu_etra_N;modesty capacity sociability history seniority
7019;ROU;IAS;POL;F;Inc2;EduF3;EduM2;(4) Sup;Nb_Vis_O;Mixit_N;4+lang;Vecu_etra_N;extension common policy modernity competition 
7020;ROU;IAS;POL;F;Inc2;EduF2;EduM2;(1) Loc;Nb_Vis_O;Mixit_N;2lang;Vecu_etra_N;traditions multiculturalism economy european union interest
7021;ROU;IAS;POL;F;Inc2;EduF3;EduM2;(1) Loc;Nb_Vis_1a4;Mixit_N;2lang;Vecu_etra_N;historical old traditional conservative 
7022;ROU;IAS;POL;F;Inc2;EduF2;EduM2;(3) Nat;Nb_Vis_1a4;Mixit_N;4+lang;Vecu_etra_N;civilization history resources culture 
7023;ROU;IAS;POL;F;Inc3;EduF2;EduM3;(1) Loc;Nb_Vis_O;Mixit_N;4+lang;Vecu_etra_N;richness middle class discrimination multiculturalism 
7024;ROU;IAS;POL;F;Inc2;EduF3;EduM3;      .;Nb_Vis_1a4;Mixit_N;3lang;Vecu_etra_N;association development educations multiculturalism 
7025;ROU;IAS;POL;F;Inc2;EduF2;EduM2;      .;Nb_Vis_O;Mixit_N;4+lang;Vecu_etra_N;homogeneity    
7026;ROU;IAS;POL;F;Inc3;EduF3;EduM3;(3) Nat;Nb_Vis_1a4;Mixit_N;3lang;Vecu_etra_N;cultural homogeneity european union   
7027;ROU;IAS;POL;F;Inc1;EduF1;EduM2;(3) Nat;Nb_Vis_O;Mixit_N;3lang;Vecu_etra_N;freedom of circulation diversity multiculturalism  
7028;ROU;IAS;POL;M;Inc2;EduF4;EduM4;(3) Nat;Nb_Vis5;Mixit_N;4+lang;Vecu_etra_O;discrimination nationalism interest justify prevarication
7029;ROU;IAS;POL;F;Inc2;EduF2;EduM3;(7)Mul;Nb_Vis_O;Mixit_N;4+lang;Vecu_etra_N;freedom rroms euro opportunity english
7030;ROU;IAS;POL;F;Inc2;EduF3;EduM3;(4) Sup;Nb_Vis_1a4;Mixit_N;3lang;Vecu_etra_N;opportunity prosperity freedom  
7031;ROU;IAS;POL;F;Inc2;EduF2;EduM2;(3) Nat;Nb_Vis_1a4;Mixit_N;3lang;Vecu_etra_N;culture history civilization model 
7032;ROU;IAS;POL;M;Inc3;EduF3;EduM3;(3) Nat;Nb_Vis_1a4;Mixit_N;3lang;Vecu_etra_N;christianity democracy   
7033;ROU;IAS;POL;M;Inc2;EduF3;EduM3;(5) Glo;Nb_Vis5;Mixit_N;3lang;Vecu_etra_O;unity diversity seniority  
7034;ROU;IAS;POL;M;Inc3;EduF3;EduM2;(5) Glo;Nb_Vis_1a4;Mixit_N;3lang;Vecu_etra_N;unity diversity entity cohesion competition
7035;ROU;IAS;POL;M;Inc3;EduF3;EduM3;(5) Glo;Nb_Vis_1a4;Mixit_N;3lang;Vecu_etra_N;spirituality conflict culture democracy history
7036;ROU;IAS;POL;M;Inc1;EduF3;EduM3;(5) Glo;Nb_Vis5;Mixit_O;3lang;Vecu_etra_O;extended membership European Union different intensities
7037;ROU;IAS;POL;M;Inc2;EduF2;EduM2;(5) Glo;Nb_Vis5;Mixit_N;4+lang;Vecu_etra_O;history civilization culture christianity 
7038;ROU;IAS;POL;M;Inc2;EduF2;EduM2;(2) Inf;Nb_Vis5;Mixit_N;3lang;Vecu_etra_O;culture religion tradition history unity
7039;ROU;IAS;POL;M;Inc3;EduF3;EduM3;(3) Nat;Nb_Vis_1a4;Mixit_N;2lang;Vecu_etra_N;diversity security unity prosperity 
7040;ROU;IAS;POL;M;Inc3;EduF4;EduM4;(6) Oth;Nb_Vis5;Mixit_N;2lang;Vecu_etra_N;ancient continent unity fraternity security 
7041;ROU;IAS;POL;M;Inc3;EduF3;EduM3;(4) Sup;Nb_Vis5;Mixit_N;4+lang;Vecu_etra_N;evolution development culture diversity 
7042;RUS;KHV;POL;M;Inc3;EduF4;EduM4;(3) Nat;Nb_Vis_1a4;Mixit_N;2lang;Vecu_etra_N;bmw football technology weather 
7043;RUS;KHV;POL;M;Inc3;EduF3;EduM4;(3) Nat;Nb_Vis_O;Mixit_N;2lang;Vecu_etra_N;football barcelona good beauty far away
7044;RUS;KHV;POL;F;Inc3;EduF3;EduM3;(1) Loc;Nb_Vis_1a4;Mixit_N;2lang;Vecu_etra_N;civilization fashion beauty mentality entertainment
7045;RUS;KHV;POL;F;Inc2;EduF2;EduM2;(3) Nat;Nb_Vis_1a4;Mixit_N;2lang;Vecu_etra_N;fashion parfum beauty cosmetics relax
7046;RUS;KHV;POL;F;Inc3;EduF2;EduM3;(1) Loc;Nb_Vis_O;Mixit_N;2lang;Vecu_etra_N;fashion cosmetics beauty money relax
7047;RUS;KHV;POL;F;Inc3;EduF4;EduM3;(3) Nat;Nb_Vis_1a4;Mixit_N;3lang;Vecu_etra_N;beauty parfum fashion queen victoria mussolini
7048;RUS;KHV;POL;F;Inc1;EduF3;EduM3;(3) Nat;Nb_Vis_1a4;Mixit_N;0-1lang;Vecu_etra_N;developed countries big ben   
7049;RUS;KHV;POL;F;Inc3;EduF3;EduM4;(7)Mul;Nb_Vis_1a4;Mixit_N;2lang;Vecu_etra_N;fashion far away beauty expensive euro
7050;RUS;KHV;POL;M;Inc3;EduF4;EduM3;(1) Loc;Nb_Vis_1a4;Mixit_N;0-1lang;Vecu_etra_N;resorts bmw beauty relax warm
7051;RUS;KHV;POL;F;Inc3;EduF4;EduM2;(3) Nat;Nb_Vis_1a4;Mixit_N;0-1lang;Vecu_etra_N;relax resorts beauty fashion money
7052;RUS;KHV;POL;M;Inc3;EduF3;EduM3;(3) Nat;Nb_Vis_O;Mixit_O;0-1lang;Vecu_etra_N;euro war nazism napoleon hitler
7055;RUS;KHV;POL;M;Inc3;EduF3;EduM3;(3) Nat;Nb_Vis_1a4;Mixit_N;0-1lang;Vecu_etra_N;the old world the renaissance culture macaroni antiquity
7056;RUS;KHV;POL;M;Inc1;EduF3;EduM3;(7)Mul;Nb_Vis_O;Mixit_O;0-1lang;Vecu_etra_N;economic development resorts   
7057;RUS;KHV;POL;F;Inc2;EduF3;EduM2;(3) Nat;Nb_Vis_O;Mixit_O;2lang;Vecu_etra_N;fashion cars developed scientific and technological advance exotic architecture
7058;RUS;KHV;POL;M;Inc2;EduF4;;(3) Nat;Nb_Vis_1a4;Mixit_O;2lang;Vecu_etra_N;money work cars drugs fame
7059;RUS;KHV;POL;F;Inc3;EduF2;EduM4;(3) Nat;Nb_Vis_1a4;Mixit_O;2lang;Vecu_etra_N;chanel ferrari fashion  
7060;RUS;KHV;POL;F;Inc3;EduF3;EduM4;(3) Nat;Nb_Vis_1a4;Mixit_N;0-1lang;Vecu_etra_N;alps football euro castles fashion
7061;RUS;KHV;POL;F;Inc1;EduF3;EduM3;(2) Inf;Nb_Vis_O;Mixit_N;0-1lang;Vecu_etra_N;more developed countries    
7062;RUS;KHV;POL;F;Inc2;EduF3;EduM4;(7)Mul;Nb_Vis_O;Mixit_N;2lang;Vecu_etra_N;fashion cosmetics fascism  
7063;RUS;KHV;POL;F;Inc2;EduF2;EduM2;(7)Mul;Nb_Vis_O;Mixit_N;2lang;Vecu_etra_N;fashion cinema clothes parfum 
7064;RUS;KHV;POL;F;Inc3;EduF3;EduM3;(3) Nat;Nb_Vis_O;Mixit_N;0-1lang;Vecu_etra_N;eiffel tower big ben louvre bastille buckingham palace
7065;RUS;KHV;POL;M;Inc3;EduF3;EduM4;(7)Mul;Nb_Vis_O;Mixit_N;3lang;Vecu_etra_N;championship chelsi arsenal football bmw
7066;RUS;KHV;POL;F;Inc3;EduF4;EduM3;(5) Glo;Nb_Vis_O;Mixit_N;3lang;Vecu_etra_N;developed countries ferrari   
7067;RUS;KHV;POL;M;Inc2;EduF2;EduM2;(1) Loc;Nb_Vis_O;Mixit_O;2lang;Vecu_etra_N;football antiquity italy relax 
7068;RUS;KHV;POL;M;Inc3;EduF3;EduM3;(7)Mul;Nb_Vis_O;Mixit_N;2lang;Vecu_etra_N;championship football formula-1  
7069;RUS;KHV;POL;F;Inc3;EduF3;EduM3;(3) Nat;Nb_Vis_O;Mixit_N;0-1lang;Vecu_etra_N;eiffel tower big ben louvre gondola arch of triumph
7070;RUS;KHV;POL;M;Inc1;EduF4;EduM4;(1) Loc;Nb_Vis_O;Mixit_N;2lang;Vecu_etra_N;war hitler lie  
7072;RUS;KHV;POL;F;Inc1;EduF1;EduM1;(3) Nat;Nb_Vis_O;Mixit_N;0-1lang;Vecu_etra_N;fashion euro european union eiffel tower papa
7073;RUS;KHV;POL;F;Inc1;EduF3;EduM1;(3) Nat;Nb_Vis_O;Mixit_N;0-1lang;Vecu_etra_N;fashion european union euro queen 
7074;RUS;KHV;POL;F;Inc2;EduF4;EduM2;(7)Mul;Nb_Vis_1a4;Mixit_O;2lang;Vecu_etra_N;science career architecture  
7075;RUS;KHV;POL;M;Inc2;EduF3;EduM2;(3) Nat;Nb_Vis_O;Mixit_N;2lang;Vecu_etra_N;the old world european union football  
7076;RUS;KHV;POL;F;Inc2;EduF2;EduM3;(3) Nat;Nb_Vis_1a4;Mixit_N;2lang;Vecu_etra_N;prosperity quality   
7077;RUS;KHV;POL;M;Inc3;EduF4;EduM4;(7)Mul;Nb_Vis_1a4;Mixit_N;2lang;Vecu_etra_N;drugs prosperity gold  
7080;RUS;KHV;POL;F;Inc3;EduF3;EduM4;(3) Nat;Nb_Vis5;Mixit_N;2lang;Vecu_etra_N;euro good roads rest centre of the world audi
7081;RUS;KHV;POL;F;Inc2;EduF3;EduM3;(3) Nat;Nb_Vis_1a4;Mixit_N;2lang;Vecu_etra_N;football beauty dirty cars little
7082;RUS;MOW;POL;M;Inc4;EduF2;EduM4;(3) Nat;Nb_Vis5;Mixit_N;3lang;Vecu_etra_N;well-being calm schengen euro european union
7083;RUS;MOW;POL;F;Inc3;EduF4;EduM4;(5) Glo;Nb_Vis5;Mixit_N;2lang;Vecu_etra_N;foremost ancient developed rich education
7084;RUS;MOW;POL;M;Inc2;EduF3;EduM3;(3) Nat;Nb_Vis5;Mixit_N;3lang;Vecu_etra_N;european union euro stability high standard of living 
7085;RUS;MOW;POL;M;Inc3;EduF2;EduM4;(1) Loc;Nb_Vis_1a4;Mixit_O;4+lang;Vecu_etra_N;euro european union   
7086;RUS;MOW;POL;M;Inc3;EduF3;EduM4;(3) Nat;Nb_Vis_1a4;Mixit_O;3lang;Vecu_etra_N;big developed favourable  
7087;RUS;MOW;POL;M;Inc3;EduF2;EduM3;(1) Loc;Nb_Vis_1a4;Mixit_N;3lang;Vecu_etra_N;developed rich prosperity  
7089;RUS;MOW;POL;M;Inc3;EduF3;EduM4;(5) Glo;Nb_Vis5;Mixit_N;3lang;Vecu_etra_N;stability european union ecology prosperity high standard of living
7090;RUS;MOW;POL;M;Inc3;EduF3;EduM3;(1) Loc;Nb_Vis5;Mixit_N;2lang;Vecu_etra_N;european union economy stability  
7091;RUS;MOW;POL;F;Inc2;EduF4;EduM4;(6) Oth;Nb_Vis5;Mixit_O;4+lang;Vecu_etra_O;stability progress solidarity ecology success
7092;RUS;MOW;POL;M;Inc3;EduF4;EduM3;(3) Nat;Nb_Vis5;Mixit_O;4+lang;Vecu_etra_O;freedom democracy politeness friendliness 
7094;RUS;MOW;POL;M;Inc2;EduF3;EduM3;(3) Nat;Nb_Vis_O;Mixit_N;3lang;Vecu_etra_N;european union european standards competitor usa  
7095;RUS;MOW;POL;M;Inc3;EduF3;EduM3;(3) Nat;Nb_Vis5;Mixit_N;3lang;Vecu_etra_N;prosperity strong   
7097;RUS;MOW;POL;M;Inc3;EduF3;EduM3;(3) Nat;Nb_Vis5;Mixit_N;4+lang;Vecu_etra_N;order cleanness culture  
7098;RUS;MOW;POL;M;Inc3;EduF3;EduM3;(3) Nat;Nb_Vis5;Mixit_O;4+lang;Vecu_etra_N;euro open state frontier   
7099;RUS;MOW;POL;M;Inc3;EduF3;EduM4;(5) Glo;Nb_Vis5;Mixit_O;4+lang;Vecu_etra_O;euro high standard of living high standard of education  
7100;RUS;MOW;POL;F;Inc3;EduF2;EduM4;(3) Nat;Nb_Vis_1a4;Mixit_O;4+lang;Vecu_etra_O;industrial and post-industrial developed conscience personal rights systematicness 
7101;RUS;MOW;POL;M;Inc3;EduF3;EduM4;(3) Nat;Nb_Vis_1a4;Mixit_N;4+lang;Vecu_etra_N;developed culture money european union education
7102;RUS;MOW;POL;F;Inc2;EduF3;EduM3;(3) Nat;Nb_Vis5;Mixit_O;3lang;Vecu_etra_N;civilization tourism cleanness european union white  official  salary
7103;RUS;MOW;POL;F;Inc3;EduF4;EduM4;(7)Mul;Nb_Vis5;Mixit_N;3lang;Vecu_etra_N;development common interests common history  
7104;RUS;MOW;POL;F;Inc3;EduF4;EduM3;(4) Sup;Nb_Vis5;Mixit_O;3lang;Vecu_etra_N;quality development integration european standard peaceful relation
7105;RUS;MOW;POL;M;Inc3;;EduM4;(3) Nat;Nb_Vis5;Mixit_O;3lang;Vecu_etra_O;development prosperity support collaboration dependence
7106;RUS;MOW;POL;M;Inc3;EduF3;EduM4;(1) Loc;Nb_Vis5;Mixit_N;3lang;Vecu_etra_N;high level of economical development high standard of living high level of culture  
7107;RUS;MOW;POL;F;Inc2;EduF2;EduM2;(3) Nat;Nb_Vis5;Mixit_N;3lang;Vecu_etra_N;development european union modernity world 
7108;RUS;MOW;POL;F;Inc3;EduF3;EduM4;(5) Glo;Nb_Vis_1a4;Mixit_O;2lang;Vecu_etra_O;perspective union culture  
7111;RUS;MOW;POL;M;Inc2;EduF3;EduM3;(1) Loc;Nb_Vis5;Mixit_O;3lang;Vecu_etra_N;civilization developed and possibility trust and reliability  
7112;RUS;MOW;POL;M;Inc2;EduF3;EduM3;(3) Nat;Nb_Vis5;Mixit_N;3lang;Vecu_etra_N;integration european union continent development of country peace
7113;RUS;MOW;POL;M;Inc3;EduF4;EduM4;(3) Nat;Nb_Vis5;Mixit_N;3lang;Vecu_etra_N;european union globalization freedoms  market capital work  
7114;RUS;MOW;POL;F;Inc3;EduF4;EduM4;(1) Loc;Nb_Vis5;Mixit_N;3lang;Vecu_etra_N;european union euro visa schengen 
7115;RUS;MOW;POL;M;Inc3;EduF4;EduM4;(6) Oth;Nb_Vis5;Mixit_O;4+lang;Vecu_etra_O;tolerance christian history science and religion  
7116;RUS;MOW;POL;M;Inc2;EduF2;EduM3;(1) Loc;Nb_Vis5;Mixit_N;2lang;Vecu_etra_N;developed strong educatio high standard of living 
7117;RUS;MOW;POL;M;Inc3;EduF4;EduM4;(4) Sup;Nb_Vis5;Mixit_N;3lang;Vecu_etra_N;european union international monetary fund developed economy 
7118;RUS;MOW;POL;M;Inc3;EduF3;EduM3;(3) Nat;Nb_Vis_1a4;Mixit_N;3lang;Vecu_etra_N;european union developed countries world trade organization  
7119;RUS;MOW;POL;M;Inc2;EduF3;EduM4;(4) Sup;Nb_Vis5;Mixit_N;3lang;Vecu_etra_N;integration old age wine  
7120;RUS;MOW;POL;M;Inc2;EduF4;EduM2;(1) Loc;Nb_Vis5;Mixit_N;3lang;Vecu_etra_N;european union euro developed countries the old world enlightenment
7121;RUS;MOW;POL;M;Inc2;EduF4;EduM4;(1) Loc;Nb_Vis_1a4;Mixit_N;3lang;Vecu_etra_N;euro union developed  
7122;RUS;MOW;POL;F;Inc3;EduF4;EduM4;(1) Loc;Nb_Vis5;Mixit_N;3lang;Vecu_etra_O;developed finance system democracy and tolerance social oriented politic common currency similarity of cultures
7124;RUS;STW;POL;M;Inc2;EduF2;EduM2;(7)Mul;Nb_Vis_O;Mixit_N;2lang;Vecu_etra_N;european union tower nato stability wto
7125;RUS;STW;POL;F;Inc2;EduF4;EduM4;(2) Inf;Nb_Vis5;Mixit_N;0-1lang;Vecu_etra_N;cleanness high standard of culture rest sea 
7126;RUS;STW;POL;F;Inc3;EduF3;EduM3;(1) Loc;Nb_Vis_O;Mixit_N;2lang;Vecu_etra_N;high level of culture education good roads tourism trademark clothing
7127;RUS;STW;POL;F;Inc2;EduF3;EduM2;(5) Glo;Nb_Vis5;Mixit_O;2lang;Vecu_etra_N;order justice beauty good material security possibilities
7128;RUS;STW;POL;F;Inc2;EduF4;EduM2;(3) Nat;Nb_Vis_1a4;Mixit_N;2lang;Vecu_etra_N;modernity possibilities cities journey shining
7130;RUS;STW;POL;M;Inc3;EduF2;EduM3;(3) Nat;Nb_Vis_O;Mixit_N;2lang;Vecu_etra_N;culture european union euro  
7132;RUS;STW;POL;F;Inc3;EduF2;EduM2;(3) Nat;Nb_Vis_O;Mixit_O;2lang;Vecu_etra_N;european union eurovision stability conservatism collaboration
7133;RUS;STW;POL;M;Inc2;EduF4;EduM4;(3) Nat;Nb_Vis_O;Mixit_N;2lang;Vecu_etra_N;economy union force power order
7134;RUS;STW;POL;M;Inc3;EduF4;EduM4;(4) Sup;Nb_Vis_O;Mixit_O;2lang;Vecu_etra_N;the old world euro crisis european union part of world
7135;RUS;STW;POL;F;Inc3;EduF2;EduM2;(3) Nat;Nb_Vis_O;Mixit_N;2lang;Vecu_etra_N;prosperity    
7136;RUS;STW;POL;M;Inc2;EduF4;;(3) Nat;Nb_Vis_O;Mixit_N;2lang;Vecu_etra_N;european union constitution the old world renaissance euro
7137;RUS;STW;POL;F;Inc3;EduF4;EduM4;(3) Nat;Nb_Vis_1a4;Mixit_N;2lang;Vecu_etra_N;european education history science culture architecture
7138;RUS;STW;POL;F;Inc1;EduF3;EduM3;(1) Loc;Nb_Vis_O;Mixit_N;2lang;Vecu_etra_N;developed countries special mentality   
7139;RUS;STW;POL;F;Inc3;EduF3;EduM4;(3) Nat;Nb_Vis_1a4;Mixit_N;2lang;Vecu_etra_N;european union culture capitals art  
7140;RUS;STW;POL;F;Inc2;EduF3;EduM3;(3) Nat;Nb_Vis_O;Mixit_N;3lang;Vecu_etra_N;window to the europe russian people a lot of countries yellow 
7142;RUS;STW;POL;F;Inc1;EduF4;EduM4;(3) Nat;Nb_Vis_1a4;Mixit_O;3lang;Vecu_etra_N;money vanity quality consumer pleasure
7143;RUS;STW;POL;F;Inc2;EduF4;EduM3;(1) Loc;Nb_Vis_O;Mixit_O;2lang;Vecu_etra_N;prosperity career success freedom 
7144;RUS;STW;POL;F;Inc3;EduF3;EduM3;(3) Nat;Nb_Vis5;Mixit_N;2lang;Vecu_etra_N;rich beauty generous lofty 
7145;RUS;STW;POL;F;Inc2;EduF4;EduM3;(7)Mul;Nb_Vis_1a4;Mixit_N;2lang;Vecu_etra_N;development industrial modernizational rich 
7146;RUS;STW;POL;F;Inc2;EduF2;EduM3;(7)Mul;Nb_Vis_1a4;Mixit_O;4+lang;Vecu_etra_N;euro european union   
7147;RUS;STW;POL;M;Inc3;EduF3;EduM3;(3) Nat;Nb_Vis_1a4;Mixit_N;0-1lang;Vecu_etra_N;capitalism quality success prosperity freedom
7148;RUS;STW;POL;F;Inc3;EduF4;EduM1;(3) Nat;Nb_Vis_1a4;Mixit_N;2lang;Vecu_etra_N;civilization european union standard of living  
7149;RUS;STW;POL;F;Inc3;EduF3;EduM3;(3) Nat;Nb_Vis_O;Mixit_N;2lang;Vecu_etra_N;part of russia education other organisation of countries place of the rest 
7150;RUS;STW;POL;F;;EduF3;EduM3;(2) Inf;Nb_Vis_O;Mixit_N;2lang;Vecu_etra_N;architecture new technology good job rest national kitchen
7151;RUS;STW;POL;M;Inc2;EduF2;EduM2;(7)Mul;Nb_Vis_O;Mixit_N;0-1lang;Vecu_etra_N;european union euro england  
7152;RUS;STW;POL;M;Inc2;EduF3;EduM3;(3) Nat;Nb_Vis_O;Mixit_N;2lang;Vecu_etra_N;european union future youth  
7153;RUS;STW;POL;F;Inc3;EduF4;EduM3;(3) Nat;Nb_Vis_1a4;Mixit_N;3lang;Vecu_etra_N;vatican oxford the old world history culture
7154;RUS;STW;POL;F;Inc2;EduF3;EduM2;(3) Nat;Nb_Vis_1a4;Mixit_N;3lang;Vecu_etra_N;euro good roads beautiful architecture clean streets incomprehensible religion
7156;RUS;STW;POL;F;Inc2;EduF3;EduM4;(3) Nat;Nb_Vis_1a4;Mixit_N;0-1lang;Vecu_etra_N;prosperity culture public health  
7157;RUS;STW;POL;F;;EduF4;EduM3;(5) Glo;Nb_Vis_O;Mixit_O;0-1lang;Vecu_etra_N;culture beauty money respect 
7158;RUS;STW;POL;F;Inc3;EduF3;EduM4;(3) Nat;Nb_Vis_O;Mixit_N;2lang;Vecu_etra_N;old boring clear freedom comfort
7160;RUS;STW;POL;F;Inc2;EduF2;EduM2;(7)Mul;Nb_Vis_O;Mixit_O;2lang;Vecu_etra_N;france italy greece  
7161;RUS;STW;POL;F;Inc1;EduF3;EduM4;(3) Nat;Nb_Vis_1a4;Mixit_N;0-1lang;Vecu_etra_O;european union the old world foreign countries  
7162;RUS;STW;POL;M;Inc3;EduF3;EduM3;(3) Nat;Nb_Vis_O;Mixit_N;0-1lang;Vecu_etra_N;democracy christianity   
7163;RUS;STW;POL;F;Inc2;EduF3;EduM2;(3) Nat;Nb_Vis_1a4;Mixit_N;2lang;Vecu_etra_N;east high level of development euro  
7164;TUN;SFA;POL;M;Inc1;EduF3;EduM4;(4) Sup;Nb_Vis_O;Mixit_N;3lang;Vecu_etra_N;human rights    
7167;TUN;SFA;POL;M;Inc4;EduF2;EduM4;(4) Sup;Nb_Vis5;Mixit_N;3lang;Vecu_etra_O;war racism poverty unemployment 
7168;TUN;SFA;POL;M;Inc2;EduF2;EduM2;(3) Nat;Nb_Vis_O;Mixit_N;3lang;Vecu_etra_N;civilization economic development freedom democracy 
7169;TUN;SFA;POL;M;Inc2;EduF2;EduM1;(3) Nat;Nb_Vis_O;Mixit_N;4+lang;Vecu_etra_N;emigration dream peace wealth life
7170;TUN;SFA;POL;M;Inc2;EduF1;EduM1;(3) Nat;Nb_Vis_O;Mixit_N;3lang;Vecu_etra_N;evolution scientific progress   
7171;TUN;SFA;POL;M;Inc1;EduF2;EduM1;(6) Oth;Nb_Vis_O;Mixit_O;3lang;Vecu_etra_O;rich world civilized world rational world  
7172;TUN;SFA;POL;M;Inc2;EduF1;EduM3;(1) Loc;Nb_Vis_O;Mixit_N;3lang;Vecu_etra_N;technical progress culture unity  
7173;TUN;SFA;POL;F;Inc2;EduF3;EduM2;(1) Loc;Nb_Vis_O;Mixit_N;3lang;Vecu_etra_N;culture freedom civilization humanity dignity solidarity
7174;TUN;SFA;POL;M;Inc2;EduF3;EduM3;(1) Loc;Nb_Vis_O;Mixit_N;4+lang;Vecu_etra_O;modernity growth   
7175;TUN;SFA;POL;F;Inc3;EduF3;EduM3;(1) Loc;Nb_Vis_O;Mixit_N;4+lang;Vecu_etra_N;emigration    
7176;TUN;SFA;POL;M;Inc2;EduF1;EduM2;(5) Glo;Nb_Vis_O;Mixit_N;3lang;Vecu_etra_N;modernity freedom growth racism 
7178;TUN;SFA;POL;M;Inc3;EduF2;EduM4;(3) Nat;Nb_Vis_O;Mixit_N;3lang;Vecu_etra_N;cultural unity economic unity civilization  
7179;TUN;SFA;POL;F;Inc2;EduF1;EduM2;(3) Nat;Nb_Vis_1a4;Mixit_N;3lang;Vecu_etra_O;immigration racism wealth  
7180;TUN;SFA;POL;F;Inc3;EduF2;EduM2;(1) Loc;Nb_Vis_O;Mixit_N;3lang;Vecu_etra_N;immigration racism   
7181;TUN;SFA;POL;M;Inc2;EduF2;EduM2;(3) Nat;Nb_Vis_1a4;Mixit_O;3lang;Vecu_etra_O;culture development racism  
7182;TUN;SFA;POL;F;Inc3;EduF1;EduM2;(7)Mul;Nb_Vis_1a4;Mixit_N;3lang;Vecu_etra_N;civilization culture wealth racism immigration
7183;TUN;SFA;POL;F;Inc3;EduF1;EduM2;(3) Nat;Nb_Vis_1a4;Mixit_N;3lang;Vecu_etra_O;culture economy immigration  
7184;TUN;SFA;POL;F;Inc3;EduF2;EduM2;(7)Mul;Nb_Vis_O;Mixit_N;2lang;Vecu_etra_N;escape racism immigration  
7185;TUN;SFA;POL;M;Inc3;EduF3;EduM3;(3) Nat;Nb_Vis_1a4;Mixit_N;4+lang;Vecu_etra_N;racism wealth culture development technology
7186;TUN;SFA;POL;M;Inc4;EduF4;EduM4;(3) Nat;Nb_Vis_1a4;Mixit_N;3lang;Vecu_etra_N;culture racism wealth  
7187;TUN;SFA;POL;M;Inc3;EduF2;EduM3;(3) Nat;Nb_Vis_O;Mixit_N;3lang;Vecu_etra_N;immigration wealth   
7188;TUN;SFA;POL;M;Inc2;EduF2;EduM3;(4) Sup;Nb_Vis_O;Mixit_N;3lang;Vecu_etra_N;wealth    
7189;TUN;SFA;POL;F;Inc3;EduF2;EduM3;(2) Inf;Nb_Vis_O;Mixit_N;4+lang;Vecu_etra_N;opened evolution education love racism
7190;TUN;SFA;POL;F;Inc3;EduF3;EduM3;(4) Sup;Nb_Vis_O;Mixit_N;3lang;Vecu_etra_N;culture migration economy dependence 
7191;TUN;SFA;POL;F;Inc3;EduF2;EduM3;(3) Nat;Nb_Vis_O;Mixit_N;4+lang;Vecu_etra_N;economy racism evolution opened 
7192;TUN;SFA;POL;F;Inc3;EduF3;EduM3;(1) Loc;Nb_Vis_O;Mixit_N;4+lang;Vecu_etra_O;development immigration industry trade stock market
7193;TUN;SFA;POL;M;Inc1;;;(1) Loc;Nb_Vis_1a4;Mixit_N;3lang;Vecu_etra_N;actuality eternal general development industry rationalization
7194;TUN;SFA;POL;F;Inc2;EduF1;EduM3;(6) Oth;Nb_Vis_O;Mixit_N;3lang;Vecu_etra_N;economic development progress   
7195;TUN;SFA;POL;M;Inc3;EduF3;EduM2;(3) Nat;Nb_Vis_1a4;Mixit_O;4+lang;Vecu_etra_O;paradise civilization peace wealth power security
7196;TUN;SFA;POL;F;Inc3;EduF3;EduM3;(5) Glo;Nb_Vis_O;Mixit_N;3lang;Vecu_etra_N;developed security favored life advantageous life 
7197;TUN;SFA;POL;F;Inc3;EduF2;EduM3;(1) Loc;Nb_Vis_O;Mixit_N;3lang;Vecu_etra_N;technological development intellectuals routine consumer society 
7198;TUN;SFA;POL;F;Inc2;EduF2;EduM3;(3) Nat;Nb_Vis_O;Mixit_N;4+lang;Vecu_etra_O;economical development trade social development  
7199;TUN;SFA;POL;M;Inc3;EduF3;EduM4;(3) Nat;Nb_Vis_O;Mixit_N;3lang;Vecu_etra_N;labor market but not today    
7200;TUN;SFA;POL;F;Inc2;;EduM1;(1) Loc;Nb_Vis_O;Mixit_N;2lang;Vecu_etra_N;culture economical and social development technology mentality 
7201;TUN;SFA;POL;F;Inc2;EduF3;EduM2;(7)Mul;Nb_Vis_O;Mixit_N;3lang;Vecu_etra_N;well developed freedom autonomy racism mentality
7202;TUN;SFA;POL;F;Inc2;EduF1;EduM2;(7)Mul;Nb_Vis_O;Mixit_N;3lang;Vecu_etra_N;development wealth   
7203;TUN;SFA;POL;F;Inc2;EduF1;EduM1;(1) Loc;Nb_Vis_O;Mixit_N;3lang;Vecu_etra_N;development wealth racism  
7204;TUN;SFA;POL;F;Inc1;EduF1;;(2) Inf;Nb_Vis_O;Mixit_N;4+lang;Vecu_etra_N;united states development several civilization disagreement between different countries 
7205;TUN;SFA;POL;F;Inc2;EduF2;EduM3;(5) Glo;Nb_Vis_1a4;Mixit_N;2lang;Vecu_etra_N;wealth beauty democracy freedom disintegrated
7206;TUN;SFA;POL;F;Inc3;EduF2;EduM3;(6) Oth;Nb_Vis_1a4;Mixit_N;4+lang;Vecu_etra_O;economically opened hate islam racism  
7207;TUN;SFA;POL;M;Inc3;EduF1;EduM3;(3) Nat;Nb_Vis_O;Mixit_O;2lang;Vecu_etra_N;racism war   
7208;TUN;SFA;POL;M;Inc2;EduF2;EduM2;(2) Inf;Nb_Vis5;Mixit_N;0-1lang;Vecu_etra_O;war racism poverty death illness
7209;TUR;ERZ;POL;F;Inc1;EduF2;EduM4;(5) Glo;Nb_Vis_O;Mixit_N;2lang;Vecu_etra_N;spain portugal france germany 
7210;TUR;ERZ;POL;F;Inc2;EduF4;EduM4;(5) Glo;Nb_Vis_1a4;Mixit_N;2lang;Vecu_etra_N;clean order union self-interest power desire
7211;TUR;ERZ;POL;F;Inc3;EduF2;EduM2;(5) Glo;Nb_Vis_O;Mixit_N;0-1lang;Vecu_etra_N;development so-called civilization quality  
7212;TUR;ERZ;POL;M;Inc4;EduF4;EduM4;(3) Nat;Nb_Vis_O;Mixit_N;2lang;Vecu_etra_N;european union right-justice arrogance  
7213;TUR;ERZ;POL;M;Inc4;EduF3;EduM4;(3) Nat;Nb_Vis_1a4;Mixit_N;3lang;Vecu_etra_O;corrupt facism   
7214;TUR;ERZ;POL;F;Inc3;EduF2;EduM2;(3) Nat;Nb_Vis_O;Mixit_N;0-1lang;Vecu_etra_N;conspiration self-interest developed technology enemies of turkey
7215;TUR;ERZ;POL;F;Inc3;EduF2;EduM3;(1) Loc;Nb_Vis_O;Mixit_N;0-1lang;Vecu_etra_N;full employment energy technology corruption west
7216;TUR;ERZ;POL;F;Inc3;;EduM3;(1) Loc;Nb_Vis_O;Mixit_N;2lang;Vecu_etra_N;freedom development technology  
7217;TUR;ERZ;POL;F;Inc3;EduF2;;(3) Nat;Nb_Vis_O;Mixit_N;0-1lang;Vecu_etra_N;technology development   
7218;TUR;ERZ;POL;M;Inc3;EduF2;EduM3;(7)Mul;Nb_Vis_O;Mixit_N;2lang;Vecu_etra_N;freedom development technology art 
7219;TUR;ERZ;POL;M;Inc3;EduF2;EduM3;(1) Loc;Nb_Vis_O;Mixit_N;0-1lang;Vecu_etra_N;technology imperialism policy racism self-interest
7220;TUR;ERZ;POL;M;Inc3;EduF2;EduM3;(3) Nat;Nb_Vis_O;Mixit_N;2lang;Vecu_etra_N;turan territories under occupation    
7221;TUR;ERZ;POL;F;Inc3;EduF3;EduM3;(3) Nat;Nb_Vis_O;Mixit_N;2lang;Vecu_etra_N;different from us cultural difference interesting different no place for us
7222;TUR;ERZ;POL;M;Inc3;EduF2;EduM3;(1) Loc;Nb_Vis_O;Mixit_N;0-1lang;Vecu_etra_N;imf nato european union  
7224;TUR;ERZ;POL;F;Inc3;EduF2;EduM4;(1) Loc;Nb_Vis_O;Mixit_N;0-1lang;Vecu_etra_N;comfortable economy   
7225;TUR;ERZ;POL;F;Inc3;EduF3;EduM3;(1) Loc;Nb_Vis_O;Mixit_N;0-1lang;Vecu_etra_N;economy war interest exploitation 
7226;TUR;ERZ;POL;M;Inc3;EduF3;EduM4;(3) Nat;Nb_Vis_O;Mixit_N;2lang;Vecu_etra_N;imperialist strict heartless  
7227;TUR;ERZ;POL;M;Inc2;EduF2;EduM3;(3) Nat;Nb_Vis_O;Mixit_N;2lang;Vecu_etra_N;imperialist colonist christian  
7228;TUR;ERZ;POL;M;Inc1;EduF3;EduM1;(3) Nat;Nb_Vis_O;Mixit_N;0-1lang;Vecu_etra_N;uncertain fake history   
7229;TUR;ERZ;POL;M;Inc3;EduF2;EduM4;(3) Nat;Nb_Vis_O;Mixit_N;0-1lang;Vecu_etra_N;colony imperialist union   
7230;TUR;ERZ;POL;F;Inc3;EduF2;EduM4;(3) Nat;Nb_Vis_O;Mixit_N;2lang;Vecu_etra_N;development technology progressive  
7231;TUR;ERZ;POL;F;Inc3;EduF3;EduM4;(3) Nat;Nb_Vis_O;Mixit_N;2lang;Vecu_etra_N;developed technology strong  
7232;TUR;ERZ;POL;F;Inc3;EduF2;EduM2;(5) Glo;Nb_Vis_O;Mixit_N;0-1lang;Vecu_etra_N;imperialism political self-interest racialist 
7233;TUR;ERZ;POL;M;Inc3;EduF4;EduM3;(6) Oth;Nb_Vis_O;Mixit_N;0-1lang;Vecu_etra_N;bad heartless non-human  
7234;TUR;ERZ;POL;F;Inc3;EduF3;EduM4;(5) Glo;Nb_Vis_1a4;Mixit_N;0-1lang;Vecu_etra_N;self-interest political   
7235;TUR;ERZ;POL;F;Inc4;EduF3;EduM3;(5) Glo;Nb_Vis_O;Mixit_N;3lang;Vecu_etra_N;enemy suffer from the past   
7236;TUR;ERZ;POL;M;Inc2;EduF1;EduM2;(3) Nat;Nb_Vis_O;Mixit_N;3lang;Vecu_etra_N;the most livable place in the world    
7237;TUR;ERZ;POL;M;Inc2;EduF1;EduM2;(1) Loc;Nb_Vis_O;Mixit_N;2lang;Vecu_etra_N;peace happiness interest violence fear
7238;TUR;ERZ;POL;M;Inc2;EduF2;EduM2;(3) Nat;Nb_Vis_O;Mixit_N;2lang;Vecu_etra_N;european union imf capitalism  
7239;TUR;ERZ;POL;M;Inc2;EduF1;EduM2;(2) Inf;Nb_Vis_O;Mixit_N;2lang;Vecu_etra_N;christian union turan land attilla  
7240;TUR;ERZ;POL;M;Inc2;EduF2;EduM2;(3) Nat;Nb_Vis_O;Mixit_N;3lang;Vecu_etra_N;self-interest imperialist   
7241;TUR;ERZ;POL;M;Inc2;EduF2;EduM3;(3) Nat;Nb_Vis_O;Mixit_N;2lang;Vecu_etra_N;imperialist colonialist selfish  
7242;TUR;ERZ;POL;M;Inc2;EduF2;EduM2;(5) Glo;Nb_Vis_O;Mixit_N;2lang;Vecu_etra_N;difficult imperialist liberal heartless attractive
7243;TUR;ERZ;POL;F;Inc2;EduF3;EduM3;(1) Loc;Nb_Vis_O;Mixit_N;0-1lang;Vecu_etra_N;industry european union   
7244;TUR;ERZ;POL;M;Inc2;EduF2;EduM3;(7)Mul;Nb_Vis_O;Mixit_N;2lang;Vecu_etra_N;aleck extremely christian strong  
7245;TUR;ERZ;POL;M;Inc2;EduF1;EduM1;(1) Loc;Nb_Vis_O;Mixit_N;0-1lang;Vecu_etra_N;imperialist nonhuman enemy of turkey  
7246;TUR;IST;POL;F;Inc3;EduF2;EduM3;(5) Glo;Nb_Vis_O;Mixit_N;3lang;Vecu_etra_N;democracy opportunity bureaucracy fundamental rights and freedom liberalism
7247;TUR;IST;POL;F;Inc2;EduF2;EduM2;(3) Nat;Nb_Vis_O;Mixit_N;2lang;Vecu_etra_N;modern civil imperialist  
7248;TUR;IST;POL;F;Inc2;EduF2;EduM2;(4) Sup;Nb_Vis_O;Mixit_N;2lang;Vecu_etra_N;undemocratic pressure difficult membership unequal law and regulations  
7249;TUR;IST;POL;M;Inc3;EduF3;EduM2;(5) Glo;Nb_Vis_O;Mixit_N;3lang;Vecu_etra_N;historical partnership market contradictions separation 
7250;TUR;IST;POL;M;Inc2;EduF2;EduM2;(7)Mul;Nb_Vis_O;Mixit_N;3lang;Vecu_etra_N;political dwarf imperial economic giant  
