2321;IND;DEL;BUS;M;Inc3;EduF4;EduM4;(1) Loc;Nb_Vis_1a4;Mixit_N;2lang;Vecu_etra_N;beautiful educated advanced fast sophisticated
2322;IND;DEL;BUS;M;Inc2;EduF2;EduM2;(5) Glo;Nb_Vis_1a4;Mixit_N;2lang;Vecu_etra_N;serene luxurious peaceful beautiful healthy
2323;IND;DEL;BUS;M;Inc3;EduF2;EduM3;(1) Loc;Nb_Vis_O;Mixit_N;4+lang;Vecu_etra_N;snow vodka wine fruits pubs
2324;IND;DEL;BUS;M;Inc3;EduF4;EduM4;(5) Glo;Nb_Vis_1a4;Mixit_N;3lang;Vecu_etra_O;the place to be    
2325;IND;DEL;BUS;M;Inc2;EduF4;EduM3;(4) Sup;Nb_Vis_1a4;Mixit_N;3lang;Vecu_etra_N;football wine courtesy food sex
2326;IND;DEL;BUS;M;Inc3;EduF4;EduM3;(1) Loc;Nb_Vis_1a4;Mixit_N;4+lang;Vecu_etra_N;luxurious sports beauty football fun
2327;IND;DEL;BUS;M;Inc2;EduF2;EduM2;(2) Inf;Nb_Vis_1a4;Mixit_N;4+lang;Vecu_etra_N;old developed   
2328;IND;DEL;BUS;M;Inc4;EduF4;EduM4;(3) Nat;Nb_Vis_1a4;Mixit_N;4+lang;Vecu_etra_N;beautiful culture automobile fashion education
2329;IND;DEL;BUS;M;Inc2;EduF3;EduM3;(2) Inf;Nb_Vis_1a4;Mixit_N;2lang;Vecu_etra_N;regionalism ev beauty developed 
2331;IND;DEL;BUS;F;Inc3;EduF4;EduM4;(7)Mul;Nb_Vis_1a4;Mixit_N;2lang;Vecu_etra_N;expansive scenic great food  
2332;IND;DEL;BUS;F;Inc3;EduF4;EduM4;(3) Nat;Nb_Vis_1a4;Mixit_N;2lang;Vecu_etra_N;art food travel wine 
2333;IND;MAA;BUS;M;Inc3;EduF2;EduM2;(3) Nat;Nb_Vis_O;Mixit_N;4+lang;Vecu_etra_N;architecture history culture ice snow
2334;IND;MAA;BUS;M;Inc3;EduF1;EduM3;(1) Loc;Nb_Vis_O;Mixit_N;3lang;Vecu_etra_N;rich heritage clumsy traditional environmental friendly
2335;IND;MAA;BUS;M;Inc3;EduF2;EduM2;(3) Nat;Nb_Vis_O;Mixit_N;2lang;Vecu_etra_N;rich terrorist employment unity religious
2336;IND;MAA;BUS;M;Inc3;EduF2;EduM2;(6) Oth;Nb_Vis_O;Mixit_N;3lang;Vecu_etra_N;land of flourishper    
2337;IND;MAA;BUS;F;Inc3;EduF3;EduM4;(3) Nat;Nb_Vis_O;Mixit_N;3lang;Vecu_etra_N;wealth growth high standard of living big continent 
2338;IND;MAA;BUS;M;Inc3;EduF3;EduM4;(6) Oth;Nb_Vis_O;Mixit_N;4+lang;Vecu_etra_N;infrastructure  rome soviet  russia girls  amsterdam  
2339;IND;MAA;BUS;F;Inc2;EduF1;EduM1;(5) Glo;Nb_Vis_O;Mixit_N;2lang;Vecu_etra_N;europe and asia both are continent    
2340;IND;MAA;BUS;M;Inc2;EduF2;EduM2;(3) Nat;Nb_Vis_1a4;Mixit_N;2lang;Vecu_etra_N;east india company united kingdom elizabeth eiffel tower swiss bank big ben
2341;IND;MAA;BUS;M;Inc3;EduF2;EduM3;(3) Nat;Nb_Vis_O;Mixit_N;4+lang;Vecu_etra_N;powerful country well developed religious trading power hard-working people
2342;IND;MAA;BUS;M;Inc2;EduF1;EduM2;(1) Loc;Nb_Vis_O;Mixit_N;3lang;Vecu_etra_N;rich heritage traditional  
2343;IND;MAA;BUS;M;Inc2;EduF2;EduM2;(1) Loc;Nb_Vis_O;Mixit_N;2lang;Vecu_etra_N;rich country heritage traditional  
2344;IND;MAA;BUS;F;Inc3;EduF3;EduM4;(3) Nat;Nb_Vis_O;Mixit_N;3lang;Vecu_etra_N;money work luxury war leaders monuments
2345;IND;MAA;BUS;F;Inc2;EduF3;EduM3;(3) Nat;Nb_Vis_O;Mixit_N;3lang;Vecu_etra_N;tourism largest continent literature mythology world war
2346;IND;MAA;BUS;F;Inc2;EduF2;EduM2;      .;Nb_Vis_O;Mixit_N;2lang;Vecu_etra_N;sports foods religious lifestyle fashion
2347;IND;MAA;BUS;F;Inc2;EduF1;EduM1;(3) Nat;Nb_Vis_O;Mixit_N;2lang;Vecu_etra_N;language food  fast food culture wise it is direction dressing sense medical benefits they were going
2348;IND;MAA;BUS;M;Inc3;EduF2;EduM2;(7)Mul;Nb_Vis_O;Mixit_N;2lang;Vecu_etra_N;ancient music and art traditions food 
2349;IND;MAA;BUS;F;Inc3;EduF2;EduM2;(3) Nat;Nb_Vis_O;Mixit_N;3lang;Vecu_etra_N;study culture good education schools good culture 
2350;IND;MAA;BUS;F;Inc2;EduF4;EduM2;(1) Loc;Nb_Vis_O;Mixit_N;4+lang;Vecu_etra_N;clothes restaurants french accent kind nature of people culture
2351;IND;MAA;BUS;F;Inc3;EduF2;EduM2;(5) Glo;Nb_Vis_O;Mixit_N;2lang;Vecu_etra_N;europe is one among the four large continents in the world    
2352;IND;MAA;BUS;M;Inc2;EduF2;EduM3;      .;Nb_Vis_1a4;Mixit_O;3lang;Vecu_etra_O;restaurants culture education employment cars
2353;IND;MAA;BUS;F;Inc2;EduF1;EduM2;(7)Mul;Nb_Vis_O;Mixit_N;2lang;Vecu_etra_N;rich in natural resources    
2354;IND;MAA;BUS;F;Inc2;EduF2;EduM2;(5) Glo;Nb_Vis_O;Mixit_N;3lang;Vecu_etra_N;food art traditions museums monuments
2355;IND;MAA;BUS;M;Inc3;EduF2;EduM2;(3) Nat;Nb_Vis_O;Mixit_N;3lang;Vecu_etra_N;culture history lifestyle  
2356;IND;MAA;BUS;F;;EduF3;EduM3;(5) Glo;Nb_Vis_1a4;Mixit_N;4+lang;Vecu_etra_O;traditions monuments museums good culture
2357;IND;MAA;BUS;F;Inc2;EduF2;EduM4;(3) Nat;Nb_Vis_O;Mixit_N;3lang;Vecu_etra_N;nice place to visit forests lakes food culture
2358;IND;MAA;BUS;F;Inc2;EduF2;EduM2;(1) Loc;Nb_Vis_O;Mixit_N;2lang;Vecu_etra_N;no words    
2359;IND;MAA;BUS;F;Inc3;EduF1;EduM2;(3) Nat;Nb_Vis_O;Mixit_N;3lang;Vecu_etra_N;vast tradition ancient culture football
2360;IND;MAA;BUS;F;Inc3;EduF2;EduM3;(3) Nat;Nb_Vis_O;Mixit_N;3lang;Vecu_etra_N;good education food football culture tourist place
2361;IND;MAA;BUS;F;Inc3;EduF2;EduM4;(3) Nat;Nb_Vis_O;Mixit_N;2lang;Vecu_etra_N;sports people science technology physical evidence
2362;IND;MAA;BUS;F;Inc3;EduF3;EduM3;(5) Glo;Nb_Vis_O;Mixit_N;2lang;Vecu_etra_N;sports technology   
2363;IND;MAA;BUS;F;Inc3;EduF3;EduM3;(5) Glo;Nb_Vis_O;Mixit_N;2lang;Vecu_etra_N;largest continent in the world    
2364;IND;MAA;BUS;M;Inc3;EduF4;EduM4;(3) Nat;Nb_Vis_O;Mixit_N;4+lang;Vecu_etra_N;cars football euro  
2365;IND;MAA;BUS;M;Inc3;EduF2;EduM2;(1) Loc;Nb_Vis_O;Mixit_N;2lang;Vecu_etra_N;i love europe    
2366;IND;MAA;BUS;M;Inc3;EduF3;EduM2;(1) Loc;Nb_Vis_O;Mixit_N;2lang;Vecu_etra_N;super nations are from europe    
2367;IND;MAA;BUS;M;Inc2;EduF2;EduM2;(6) Oth;Nb_Vis_O;Mixit_N;2lang;Vecu_etra_N;good country its being developing their economic status   
2368;IND;MAA;BUS;M;Inc2;EduF2;EduM2;(6) Oth;Nb_Vis_O;Mixit_N;3lang;Vecu_etra_N;europe has become a developing continent with the countries like united kingdom iran and saudi arabia    
2369;IND;MAA;BUS;M;Inc3;EduF3;EduM4;(1) Loc;Nb_Vis_1a4;Mixit_N;2lang;Vecu_etra_N;i hate europe    
2370;IND;MAA;BUS;M;Inc3;EduF3;EduM3;(3) Nat;Nb_Vis_O;Mixit_N;2lang;Vecu_etra_N;culture history lifestyle  
2371;IND;MAA;BUS;F;Inc2;EduF2;EduM2;      .;Nb_Vis_O;Mixit_N;2lang;Vecu_etra_N;happiness life style culture tradition 
2372;IND;MAA;BUS;F;Inc3;EduF2;EduM3;(3) Nat;Nb_Vis_O;Mixit_N;2lang;Vecu_etra_N;lifestyle language culture  
2373;IND;MAA;BUS;M;Inc3;EduF2;EduM3;(1) Loc;Nb_Vis_1a4;Mixit_O;3lang;Vecu_etra_O;manchester united club famous in europe    
2374;IND;MAA;BUS;F;Inc3;EduF2;EduM2;(3) Nat;Nb_Vis_O;Mixit_N;2lang;Vecu_etra_N;developing countries great monuments war between's  
2375;IND;MAA;BUS;M;Inc4;EduF3;EduM4;(1) Loc;Nb_Vis_O;Mixit_N;2lang;Vecu_etra_N;rich country    
2376;IND;MAA;BUS;M;Inc3;EduF2;EduM3;(3) Nat;Nb_Vis_O;Mixit_N;3lang;Vecu_etra_N;kohinoor diamond pounds oxford university france switzerland
2377;IND;MAA;BUS;M;Inc2;EduF2;EduM4;(5) Glo;Nb_Vis_O;Mixit_N;2lang;Vecu_etra_N;eiffel tower england cricket team urine food euro
2378;IND;MAA;BUS;M;Inc2;EduF1;EduM3;(1) Loc;Nb_Vis_O;Mixit_N;2lang;Vecu_etra_N;rich people's country i like this country   
2380;IND;MAA;BUS;M;Inc2;EduF2;EduM1;(3) Nat;Nb_Vis_O;Mixit_N;2lang;Vecu_etra_N;east india company tourism traditional  
2381;IND;MAA;BUS;M;Inc2;EduF2;EduM3;(3) Nat;Nb_Vis_O;Mixit_N;3lang;Vecu_etra_N;east india company tourism traditional  
2382;IND;MAA;BUS;F;Inc3;EduF3;EduM3;(5) Glo;Nb_Vis_O;Mixit_N;2lang;Vecu_etra_N;tradition fashions foods custom sports
2383;IND;MAA;BUS;M;Inc2;EduF2;EduM2;(3) Nat;Nb_Vis_O;Mixit_N;3lang;Vecu_etra_N;europe is a continent of many developing countries    
2384;IND;MAA;BUS;F;Inc3;EduF3;EduM3;(3) Nat;Nb_Vis_O;Mixit_N;2lang;Vecu_etra_N;people process progress europe 
2385;IND;PNY;BUS;M;Inc4;EduF4;EduM4;(1) Loc;Nb_Vis_O;Mixit_N;4+lang;Vecu_etra_N;switzerland football cheese hitler david beckham
2386;IND;PNY;BUS;M;Inc2;EduF2;EduM4;(5) Glo;Nb_Vis_O;Mixit_N;4+lang;Vecu_etra_N;euro european union developed nation englishman nato
2387;IND;PNY;BUS;M;Inc1;EduF2;EduM3;(1) Loc;Nb_Vis_O;Mixit_N;2lang;Vecu_etra_N;paris london swiss  
2388;IND;PNY;BUS;M;Inc1;EduF1;EduM2;(3) Nat;Nb_Vis_1a4;Mixit_N;2lang;Vecu_etra_N;rotten apple of basket  economically    
2389;IND;PNY;BUS;M;Inc3;EduF2;EduM3;(3) Nat;Nb_Vis_O;Mixit_N;2lang;Vecu_etra_N;football culture euro  
2390;IND;PNY;BUS;M;Inc2;EduF2;EduM3;(5) Glo;Nb_Vis_O;Mixit_N;3lang;Vecu_etra_N;prosperity peaceful economic development full employment 
2391;IND;PNY;BUS;M;Inc2;EduF1;EduM2;(1) Loc;Nb_Vis_O;Mixit_N;4+lang;Vecu_etra_N;rich developed football sports 
2392;IND;PNY;BUS;M;Inc3;EduF3;EduM4;(5) Glo;Nb_Vis_O;Mixit_N;3lang;Vecu_etra_N;swiss alps big ben eiffel tower bmw buckingham palace
2393;IND;PNY;BUS;F;Inc3;EduF3;EduM3;(3) Nat;Nb_Vis_O;Mixit_N;4+lang;Vecu_etra_N;resource full can help india    
2394;IND;PNY;BUS;F;Inc3;EduF4;EduM3;(3) Nat;Nb_Vis_1a4;Mixit_N;4+lang;Vecu_etra_N;progressive advance modern open-minded detached
2395;IND;PNY;BUS;M;Inc3;EduF3;EduM3;(3) Nat;Nb_Vis_1a4;Mixit_N;2lang;Vecu_etra_O;a union of culturally diverse states    
2396;IND;PNY;BUS;M;Inc2;EduF2;EduM2;(3) Nat;Nb_Vis_O;Mixit_N;2lang;Vecu_etra_N;prosperous cleanliness developed  
2397;IND;PNY;BUS;M;Inc3;EduF2;EduM3;(5) Glo;Nb_Vis_O;Mixit_N;4+lang;Vecu_etra_N;peaceful progressive modern costly technological
2398;IND;PNY;BUS;F;Inc4;EduF4;EduM4;(5) Glo;Nb_Vis_1a4;Mixit_N;4+lang;Vecu_etra_N;france united kingdom north atlantic ocean germany greece
2399;IND;PNY;BUS;M;Inc3;EduF2;EduM3;(3) Nat;Nb_Vis_O;Mixit_N;4+lang;Vecu_etra_N;good life style people attitude towards life   
2400;IND;PNY;BUS;M;Inc3;EduF3;EduM3;(1) Loc;Nb_Vis_O;Mixit_N;3lang;Vecu_etra_N;peace socialism overall development fun equality
2401;IND;PNY;BUS;M;Inc3;EduF2;EduM2;(6) Oth;Nb_Vis_O;Mixit_N;2lang;Vecu_etra_N;italy france spain germany finland
2402;IND;PNY;BUS;M;Inc2;EduF2;EduM3;(5) Glo;Nb_Vis_O;Mixit_N;3lang;Vecu_etra_O;ancient cultural beautiful heritage rich
2403;IND;PNY;BUS;F;Inc2;EduF3;EduM3;(6) Oth;Nb_Vis_O;Mixit_N;2lang;Vecu_etra_N;unitied through euro culture interdependent  
2404;IND;PNY;BUS;M;Inc3;EduF2;EduM3;(1) Loc;Nb_Vis_O;Mixit_N;4+lang;Vecu_etra_N;land of power and wealth    
2405;IND;PNY;BUS;M;Inc3;EduF3;EduM3;(3) Nat;Nb_Vis_O;Mixit_N;3lang;Vecu_etra_N;design italian french culture wealth
2406;IND;PNY;BUS;M;Inc2;EduF3;EduM2;(1) Loc;Nb_Vis_O;Mixit_N;2lang;Vecu_etra_N;complexity diversity respect culture 
2407;MDA;KIV;BUS;F;Inc2;EduF2;EduM2;(6) Oth;Nb_Vis_1a4;Mixit_N;3lang;Vecu_etra_N;education development high standard of life  
2408;MDA;KIV;BUS;F;Inc3;EduF4;EduM4;(3) Nat;Nb_Vis_1a4;Mixit_N;4+lang;Vecu_etra_N;development friends barcelona distance venice
2409;MDA;KIV;BUS;F;Inc3;EduF4;EduM4;(3) Nat;Nb_Vis_1a4;Mixit_N;3lang;Vecu_etra_O;integration free migration development high standard of life decent work
2410;MDA;KIV;BUS;F;Inc3;EduF4;EduM4;(3) Nat;Nb_Vis_1a4;Mixit_N;3lang;Vecu_etra_N;integration development innovations free travel 
2411;MDA;KIV;BUS;F;Inc3;EduF3;EduM4;(3) Nat;Nb_Vis5;Mixit_N;3lang;Vecu_etra_N;free travel integration cedo euro 
2412;MDA;KIV;BUS;F;Inc3;EduF2;EduM2;(1) Loc;Nb_Vis_1a4;Mixit_N;3lang;Vecu_etra_N;development prosperous integration migration 
2413;MDA;KIV;BUS;F;Inc2;EduF3;EduM3;(1) Loc;Nb_Vis_1a4;Mixit_N;3lang;Vecu_etra_N;integration free migration development  
2414;MDA;KIV;BUS;F;Inc2;EduF4;EduM4;(7)Mul;Nb_Vis_1a4;Mixit_N;4+lang;Vecu_etra_N;free travel development respect of rights future integration
2415;MDA;KIV;BUS;F;Inc2;EduF4;EduM4;(5) Glo;Nb_Vis_1a4;Mixit_N;3lang;Vecu_etra_N;globalization onu integration euro development
2416;MDA;KIV;BUS;F;Inc2;EduF3;EduM3;(5) Glo;Nb_Vis_O;Mixit_N;3lang;Vecu_etra_N;development union freedom integration no annotation
2417;MDA;KIV;BUS;F;Inc2;EduF3;EduM2;(5) Glo;Nb_Vis_1a4;Mixit_N;3lang;Vecu_etra_N;prosperity modernization beauty comfort 
2418;MDA;KIV;BUS;F;Inc2;EduF3;EduM3;(3) Nat;Nb_Vis_1a4;Mixit_N;2lang;Vecu_etra_O;development culture technology centre capital
2419;MDA;KIV;BUS;F;Inc2;EduF3;EduM3;(3) Nat;Nb_Vis_1a4;Mixit_N;2lang;Vecu_etra_N;culture industrialization civilization innovation modernization
2420;MDA;KIV;BUS;F;Inc3;EduF3;EduM4;(5) Glo;Nb_Vis5;Mixit_N;4+lang;Vecu_etra_N;prosperity modernization peace comfort 
2421;MDA;KIV;BUS;F;Inc3;EduF4;EduM3;(4) Sup;Nb_Vis_1a4;Mixit_N;3lang;Vecu_etra_O;prosperity stability   
2422;MDA;KIV;BUS;F;Inc3;EduF3;EduM3;(5) Glo;Nb_Vis_1a4;Mixit_O;3lang;Vecu_etra_O;beauty kindness wealth health friendship
2423;MDA;KIV;BUS;F;Inc1;EduF2;EduM4;(4) Sup;Nb_Vis_1a4;Mixit_N;3lang;Vecu_etra_N;honest people powers qualified labour force well-paid high culture
2424;MDA;KIV;BUS;M;Inc1;EduF3;EduM2;(1) Loc;Nb_Vis5;Mixit_N;4+lang;Vecu_etra_O;culture traditions religion polarization discrimination
2425;MDA;KIV;BUS;F;Inc3;EduF3;EduM2;(5) Glo;Nb_Vis_1a4;Mixit_N;3lang;Vecu_etra_N;prosperity modernization peace comfort 
2426;MDA;KIV;BUS;F;Inc1;EduF3;EduM2;(7)Mul;Nb_Vis_1a4;Mixit_N;3lang;Vecu_etra_N;prosperity warmth future success development opportunity
2427;MDA;KIV;BUS;F;Inc2;EduF4;EduM3;(5) Glo;Nb_Vis_1a4;Mixit_N;3lang;Vecu_etra_N;welfare economy development culture union
2428;MDA;KIV;BUS;F;Inc2;EduF1;EduM2;(4) Sup;Nb_Vis_1a4;Mixit_N;2lang;Vecu_etra_N;development freedom integrity stability cooperation
2429;MDA;KIV;BUS;F;Inc2;EduF3;EduM3;(5) Glo;Nb_Vis_1a4;Mixit_N;4+lang;Vecu_etra_N;super quick progress super advantageous economic relations   
2430;MDA;KIV;BUS;M;Inc3;EduF2;EduM1;(5) Glo;Nb_Vis_1a4;Mixit_N;3lang;Vecu_etra_N;force democracy unity  
2431;MDA;KIV;BUS;M;Inc3;EduF3;EduM1;(4) Sup;Nb_Vis_O;Mixit_N;3lang;Vecu_etra_N;development traditions history money business
2433;MDA;KIV;BUS;M;Inc3;EduF3;EduM3;(3) Nat;Nb_Vis_1a4;Mixit_N;3lang;Vecu_etra_N;development integration prosperity collaboration stability
2434;MDA;KIV;BUS;F;Inc2;EduF2;EduM2;(3) Nat;Nb_Vis_1a4;Mixit_N;3lang;Vecu_etra_N;integration cooperation stability disproof development
2435;MDA;KIV;BUS;M;Inc2;EduF3;EduM3;(7)Mul;Nb_Vis_1a4;Mixit_N;3lang;Vecu_etra_N;culture prosperity boredom moldova 
2436;MDA;KIV;BUS;F;Inc3;EduF4;EduM4;(5) Glo;Nb_Vis5;Mixit_N;3lang;Vecu_etra_N;power union moldova progress 
2437;MDA;KIV;BUS;F;Inc2;EduF3;EduM3;      .;Nb_Vis_1a4;Mixit_N;4+lang;Vecu_etra_N;euro union travel future 
2438;MDA;KIV;BUS;F;Inc2;;EduM4;(6) Oth;Nb_Vis_1a4;Mixit_N;3lang;Vecu_etra_N;peace euro internationalization  
2439;MDA;KIV;BUS;F;Inc3;EduF3;EduM4;(3) Nat;Nb_Vis_1a4;Mixit_N;4+lang;Vecu_etra_N;beautiful places history independence traditions stability
2440;MDA;KIV;BUS;F;Inc2;EduF4;EduM3;(1) Loc;Nb_Vis_1a4;Mixit_O;4+lang;Vecu_etra_N;traditions prosperity intelligence justice severity
2441;MDA;KIV;BUS;F;Inc1;EduF3;EduM4;(1) Loc;Nb_Vis_1a4;Mixit_N;4+lang;Vecu_etra_O;beautiful many rich injustice to us
2442;MDA;KIV;BUS;F;Inc2;EduF4;EduM4;(6) Oth;Nb_Vis_O;Mixit_N;4+lang;Vecu_etra_N;home    
2444;MDA;KIV;BUS;F;Inc2;EduF4;EduM3;(5) Glo;Nb_Vis_1a4;Mixit_N;3lang;Vecu_etra_N;devotion dignity power peace equality
2445;MDA;KIV;BUS;F;Inc2;EduF2;EduM2;(3) Nat;Nb_Vis_1a4;Mixit_N;3lang;Vecu_etra_N;union industrialization development equality 
2446;MDA;KIV;BUS;F;Inc3;EduF4;EduM4;(3) Nat;Nb_Vis5;Mixit_O;4+lang;Vecu_etra_O;freedom brussels euro democracy equality
2447;MLT;MLA;BUS;M;Inc3;EduF2;EduM3;(1) Loc;Nb_Vis_1a4;Mixit_N;3lang;Vecu_etra_N;economical efficient   
2448;MLT;MLA;BUS;M;Inc3;EduF1;EduM1;(1) Loc;Nb_Vis_1a4;Mixit_N;3lang;Vecu_etra_N;most civilized countries    
2449;MLT;MLA;BUS;M;Inc1;EduF1;EduM2;(6) Oth;Nb_Vis_1a4;Mixit_N;3lang;Vecu_etra_N;too slow in its decisions    
2451;MLT;MLA;BUS;M;Inc3;EduF2;EduM3;(1) Loc;Nb_Vis5;Mixit_N;3lang;Vecu_etra_N;united countries    
2452;MLT;MLA;BUS;M;Inc3;EduF2;EduM2;(3) Nat;Nb_Vis5;Mixit_N;3lang;Vecu_etra_N;strong unification    
2453;MLT;MLA;BUS;M;Inc3;EduF1;EduM2;(3) Nat;Nb_Vis_1a4;Mixit_N;4+lang;Vecu_etra_N;union of small states  countries    
2454;MLT;MLA;BUS;M;Inc2;EduF2;EduM3;(3) Nat;Nb_Vis5;Mixit_N;4+lang;Vecu_etra_N;prosperity peace culture christianity politics
2455;MLT;MLA;BUS;F;Inc3;EduF3;EduM4;(3) Nat;Nb_Vis5;Mixit_N;4+lang;Vecu_etra_N;diplomacy culture   
2456;MLT;MLA;BUS;M;Inc2;EduF3;EduM4;(4) Sup;Nb_Vis_1a4;Mixit_N;4+lang;Vecu_etra_N;united europe    
2457;MLT;MLA;BUS;M;Inc3;EduF1;EduM3;(4) Sup;Nb_Vis_1a4;Mixit_O;0-1lang;Vecu_etra_O;founded on christian beliefs    
2458;MLT;MLA;BUS;M;Inc3;EduF2;EduM2;(3) Nat;Nb_Vis_1a4;Mixit_N;4+lang;Vecu_etra_N;continent with countries aiming at common goals    
2459;MLT;MLA;BUS;F;Inc2;EduF1;EduM2;(3) Nat;Nb_Vis_1a4;Mixit_N;3lang;Vecu_etra_O;democratic freedom of speech multi-language  
2460;MLT;MLA;BUS;F;Inc2;EduF2;EduM2;(3) Nat;Nb_Vis5;Mixit_N;3lang;Vecu_etra_N;citizen union modern hi-tech 
2461;MLT;MLA;BUS;F;Inc2;EduF2;EduM3;(1) Loc;Nb_Vis_1a4;Mixit_N;3lang;Vecu_etra_N;advanced well-educated united modern 
2463;MLT;MLA;BUS;F;Inc3;EduF4;EduM4;(7)Mul;Nb_Vis_1a4;Mixit_O;3lang;Vecu_etra_O;centre organized safe comfortable eu regulations
2464;MLT;MLA;BUS;F;Inc2;EduF3;EduM3;(3) Nat;Nb_Vis_1a4;Mixit_N;3lang;Vecu_etra_N;unity small population education rights
2465;MLT;MLA;BUS;M;Inc3;EduF2;EduM2;(1) Loc;Nb_Vis_1a4;Mixit_N;2lang;Vecu_etra_N;a union of countries    
2466;MLT;MLA;BUS;F;Inc2;EduF4;EduM2;(1) Loc;Nb_Vis_1a4;Mixit_N;3lang;Vecu_etra_N;euro brussels one parliament share some ideas 
2467;MLT;MLA;BUS;F;Inc3;EduF2;EduM2;(3) Nat;Nb_Vis5;Mixit_N;4+lang;Vecu_etra_N;culture arts history progress standards
2468;MLT;MLA;BUS;M;Inc3;EduF3;EduM3;(3) Nat;Nb_Vis5;Mixit_N;4+lang;Vecu_etra_N;culture art history progress standards
2469;MLT;MLA;BUS;M;Inc3;EduF3;EduM3;(4) Sup;Nb_Vis5;Mixit_N;4+lang;Vecu_etra_N;unity common market mediterranean  
2470;MLT;MLA;BUS;M;Inc2;EduF2;EduM1;(1) Loc;Nb_Vis5;Mixit_N;3lang;Vecu_etra_N;most advanced and open minded    
2472;MLT;MLA;BUS;M;Inc4;EduF3;EduM4;(1) Loc;Nb_Vis_1a4;Mixit_N;2lang;Vecu_etra_O;to travel it is shorter    
2473;MLT;MLA;BUS;M;Inc2;EduF2;EduM2;(5) Glo;Nb_Vis_1a4;Mixit_O;3lang;Vecu_etra_N;history civilization politics materialism 
2474;MLT;MLA;BUS;M;Inc2;EduF3;EduM1;(3) Nat;Nb_Vis5;Mixit_N;3lang;Vecu_etra_N;white peace euro currency low criminality tourism
2475;MLT;MLA;BUS;F;Inc3;EduF2;EduM3;(1) Loc;Nb_Vis_1a4;Mixit_N;3lang;Vecu_etra_N;standardisation high level   
2476;MLT;MLA;BUS;M;Inc3;EduF3;EduM2;(1) Loc;Nb_Vis5;Mixit_N;3lang;Vecu_etra_N;currency rich culture food tourism 
2477;MLT;MLA;BUS;M;Inc3;EduF2;EduM2;(1) Loc;Nb_Vis_1a4;Mixit_N;4+lang;Vecu_etra_N;rich culture high level of living   
2478;MLT;MLA;BUS;M;Inc1;EduF2;EduM2;(5) Glo;Nb_Vis_1a4;Mixit_N;4+lang;Vecu_etra_N;unity peace cooperation between countries  
2479;MLT;MLA;BUS;M;Inc3;EduF1;EduM1;(1) Loc;Nb_Vis_1a4;Mixit_N;2lang;Vecu_etra_N;highly industrial economy high population politics culture
2480;MLT;MLA;BUS;F;Inc3;EduF3;EduM3;      .;Nb_Vis5;Mixit_N;3lang;Vecu_etra_N;unity culture currency  
2481;MLT;MLA;BUS;F;Inc1;EduF1;EduM2;      .;Nb_Vis_O;Mixit_N;3lang;Vecu_etra_N;sun culture   
2482;MLT;MLA;BUS;M;Inc3;EduF2;EduM1;(3) Nat;Nb_Vis5;Mixit_N;3lang;Vecu_etra_N;unity culture wealth strength tolerance
2483;MLT;MLA;BUS;M;Inc2;EduF1;EduM2;(1) Loc;Nb_Vis_1a4;Mixit_N;3lang;Vecu_etra_N;an amalgamation of various cultures    
2484;MLT;MLA;BUS;M;Inc2;EduF1;EduM2;(1) Loc;Nb_Vis_1a4;Mixit_N;3lang;Vecu_etra_N;an amalgamation of different cultures    
2485;MLT;MLA;BUS;M;Inc2;EduF3;EduM2;(3) Nat;Nb_Vis_1a4;Mixit_N;3lang;Vecu_etra_N;tariffs tax development culture arts
2486;MLT;MLA;BUS;M;Inc3;EduF3;EduM3;(1) Loc;Nb_Vis5;Mixit_N;3lang;Vecu_etra_N;european union tax money going out development culture
2487;MLT;MLA;BUS;M;Inc2;EduF2;EduM2;(3) Nat;Nb_Vis_O;Mixit_N;4+lang;Vecu_etra_N;a soup of cultures    
2488;MLT;MLA;BUS;M;Inc2;EduF2;EduM2;(4) Sup;Nb_Vis5;Mixit_N;4+lang;Vecu_etra_N;ancient gem    
2489;MLT;MLA;BUS;M;Inc3;EduF4;EduM1;(1) Loc;Nb_Vis5;Mixit_N;3lang;Vecu_etra_N;peace    
2490;MLT;MLA;BUS;F;Inc3;EduF2;EduM3;(5) Glo;Nb_Vis5;Mixit_N;3lang;Vecu_etra_O;work politics holidays sports religion
2491;MLT;MLA;BUS;F;Inc3;EduF1;EduM1;(1) Loc;Nb_Vis5;Mixit_N;3lang;Vecu_etra_N;land of opportunity and unity    
2492;MLT;MLA;BUS;F;Inc2;EduF1;EduM2;(1) Loc;Nb_Vis5;Mixit_N;2lang;Vecu_etra_N;culture arts food wine political differences
2493;MLT;MLA;BUS;M;Inc2;EduF2;EduM2;(3) Nat;Nb_Vis_1a4;Mixit_N;3lang;Vecu_etra_N;art culture food  
2494;MLT;MLA;BUS;F;Inc2;EduF2;EduM2;(1) Loc;Nb_Vis_O;Mixit_N;3lang;Vecu_etra_N;food fashion politics  
2495;MLT;MLA;BUS;M;Inc2;EduF3;EduM2;(1) Loc;Nb_Vis_1a4;Mixit_N;4+lang;Vecu_etra_N;beginning of civilization    
2496;MLT;MLA;BUS;F;Inc3;EduF2;EduM1;(3) Nat;Nb_Vis5;Mixit_N;4+lang;Vecu_etra_N;unity in diversity    
2497;MLT;MLA;BUS;M;Inc3;EduF1;EduM1;(1) Loc;Nb_Vis_1a4;Mixit_N;3lang;Vecu_etra_N;next communist region    
2498;MLT;MLA;BUS;M;Inc3;EduF2;EduM2;(3) Nat;Nb_Vis_1a4;Mixit_O;3lang;Vecu_etra_N;over developed    
2499;MLT;MLA;BUS;M;Inc3;EduF2;EduM2;(3) Nat;Nb_Vis_1a4;Mixit_N;4+lang;Vecu_etra_N;central ideas cultures strong civilized
2500;PRT;CBP;BUS;M;Inc1;EduF2;EduM1;(3) Nat;Nb_Vis_1a4;Mixit_N;3lang;Vecu_etra_N;european union euro typical food football 
2501;PRT;CBP;BUS;F;Inc3;EduF3;EduM4;(4) Sup;Nb_Vis5;Mixit_N;3lang;Vecu_etra_N;union orientation stopover  
2502;PRT;CBP;BUS;M;Inc2;EduF3;EduM3;(5) Glo;Nb_Vis_1a4;Mixit_N;2lang;Vecu_etra_N;european union    
2503;PRT;CBP;BUS;F;Inc1;EduF1;EduM4;(5) Glo;Nb_Vis_1a4;Mixit_O;2lang;Vecu_etra_N;social disparity slow growth to equal usa strong point innovation
2504;PRT;CBP;BUS;M;Inc2;EduF2;EduM2;(4) Sup;Nb_Vis_1a4;Mixit_N;3lang;Vecu_etra_N;development intelligence economy solidarity quality of life
2505;PRT;CBP;BUS;F;Inc2;EduF4;EduM3;(5) Glo;Nb_Vis_1a4;Mixit_N;2lang;Vecu_etra_N;home defense security  
2506;PRT;CBP;BUS;F;Inc2;EduF1;EduM1;(5) Glo;Nb_Vis_1a4;Mixit_N;3lang;Vecu_etra_N;european union euro communitarian european funds pope john paul ii roman coliseum
2507;PRT;CBP;BUS;F;Inc2;EduF2;EduM1;(1) Loc;Nb_Vis_1a4;Mixit_N;3lang;Vecu_etra_N;disneyland portugal's cozido pizzas tower of pisa tourist bus
2508;PRT;CBP;BUS;F;Inc2;EduF1;EduM1;(4) Sup;Nb_Vis_1a4;Mixit_O;3lang;Vecu_etra_O;culture integration monuments religion gastronomy
2509;PRT;CBP;BUS;M;Inc2;EduF1;EduM1;(4) Sup;Nb_Vis_1a4;Mixit_N;2lang;Vecu_etra_N;economy culture history politics 
2510;PRT;CBP;BUS;F;Inc3;EduF2;EduM2;(1) Loc;Nb_Vis_1a4;Mixit_O;0-1lang;Vecu_etra_N;difference inequality without barriers  
2511;PRT;CBP;BUS;F;Inc2;EduF2;EduM2;(5) Glo;Nb_Vis_1a4;Mixit_N;3lang;Vecu_etra_N;european union european community fund pope john paul ii roman coliseum 
2512;PRT;CBP;BUS;F;Inc3;EduF1;EduM2;(5) Glo;Nb_Vis_1a4;Mixit_N;3lang;Vecu_etra_N;our lady culture civilization  
2513;PRT;CBP;BUS;F;Inc3;EduF2;EduM3;(1) Loc;Nb_Vis_1a4;Mixit_N;2lang;Vecu_etra_N;civilization development human rights culture history
2514;PRT;CBP;BUS;M;Inc2;EduF1;EduM2;(5) Glo;Nb_Vis_1a4;Mixit_N;2lang;Vecu_etra_N;culture patrimony ancient identity 
2515;PRT;CBP;BUS;F;Inc3;EduF3;EduM3;(1) Loc;Nb_Vis_1a4;Mixit_N;2lang;Vecu_etra_N;integration equality expansion cooperation cultural diversity
2516;PRT;CBP;BUS;M;Inc3;EduF3;EduM3;(2) Inf;Nb_Vis_1a4;Mixit_N;2lang;Vecu_etra_N;industrialization development mankind principles morality
2517;PRT;CBP;BUS;F;Inc2;EduF3;EduM2;(1) Loc;Nb_Vis_1a4;Mixit_O;2lang;Vecu_etra_N;retardation    
2518;PRT;CBP;BUS;F;Inc2;EduF4;EduM2;(1) Loc;Nb_Vis_1a4;Mixit_N;0-1lang;Vecu_etra_N;world    
2519;PRT;CBP;BUS;M;Inc3;EduF3;EduM4;(4) Sup;Nb_Vis5;Mixit_N;3lang;Vecu_etra_N;solidarity citizenship knowledge innovation positioning
2520;PRT;EVR;BUS;M;;EduF2;EduM2;(1) Loc;Nb_Vis_1a4;Mixit_N;3lang;Vecu_etra_N;union development social  
2521;PRT;EVR;BUS;M;Inc1;EduF1;EduM1;(4) Sup;Nb_Vis_1a4;Mixit_N;2lang;Vecu_etra_N;social economy    
2522;PRT;EVR;BUS;M;Inc3;EduF3;EduM3;(5) Glo;Nb_Vis_1a4;Mixit_N;2lang;Vecu_etra_N;single coin social equality union of countries  
2523;PRT;EVR;BUS;M;Inc3;EduF3;EduM4;(4) Sup;Nb_Vis_1a4;Mixit_N;4+lang;Vecu_etra_N;union cooperation development future globalization
2524;PRT;EVR;BUS;F;Inc2;EduF4;EduM2;(1) Loc;Nb_Vis5;Mixit_N;2lang;Vecu_etra_N;european union euro society  
2525;PRT;EVR;BUS;F;Inc2;EduF2;EduM2;(5) Glo;Nb_Vis_1a4;Mixit_N;2lang;Vecu_etra_N;european union development technology  
2526;PRT;EVR;BUS;M;Inc3;EduF4;EduM4;(2) Inf;Nb_Vis_1a4;Mixit_N;3lang;Vecu_etra_N;union    
2527;PRT;EVR;BUS;F;Inc3;EduF4;EduM3;(5) Glo;Nb_Vis_1a4;Mixit_N;2lang;Vecu_etra_N;treaties war reconstruction beauty history
2528;PRT;EVR;BUS;M;Inc3;EduF3;EduM3;(5) Glo;Nb_Vis_O;Mixit_N;2lang;Vecu_etra_N;development old continent european union  
2529;PRT;EVR;BUS;M;Inc3;EduF4;EduM4;(4) Sup;Nb_Vis5;Mixit_N;3lang;Vecu_etra_N;union cosmopolitan contrasts opportunities progress
2530;PRT;EVR;BUS;M;Inc3;EduF3;EduM3;(3) Nat;Nb_Vis_1a4;Mixit_N;3lang;Vecu_etra_N;development multicultural melting pot  
2531;PRT;EVR;BUS;M;Inc3;EduF4;EduM3;(5) Glo;Nb_Vis_1a4;Mixit_N;3lang;Vecu_etra_N;union development   
2532;PRT;EVR;BUS;F;Inc2;EduF4;EduM2;(5) Glo;Nb_Vis_1a4;Mixit_N;2lang;Vecu_etra_N;union treaties brussels euro continent
2533;PRT;EVR;BUS;F;Inc2;EduF2;EduM2;(1) Loc;Nb_Vis_1a4;Mixit_N;3lang;Vecu_etra_N;euro union treaties  
2534;PRT;EVR;BUS;F;Inc3;EduF2;EduM2;(1) Loc;Nb_Vis_1a4;Mixit_N;2lang;Vecu_etra_N;union freedom of circulation   
2535;PRT;EVR;BUS;F;Inc3;EduF2;EduM2;(1) Loc;Nb_Vis_1a4;Mixit_N;2lang;Vecu_etra_N;union diversification   
2536;PRT;EVR;BUS;M;Inc2;EduF3;EduM3;(5) Glo;Nb_Vis5;Mixit_N;2lang;Vecu_etra_N;development culture   
2537;PRT;EVR;BUS;M;Inc3;EduF3;EduM3;(1) Loc;Nb_Vis5;Mixit_N;3lang;Vecu_etra_O;union economy culture evolution flavors
2538;PRT;EVR;BUS;M;Inc3;EduF4;EduM4;(5) Glo;Nb_Vis_1a4;Mixit_O;2lang;Vecu_etra_O;european old continent uefa european union 
2539;PRT;EVR;BUS;F;Inc2;EduF3;EduM1;(1) Loc;Nb_Vis_1a4;Mixit_N;4+lang;Vecu_etra_N;freedom of circulation    
2540;PRT;LIS;BUS;M;Inc3;EduF1;EduM2;(5) Glo;Nb_Vis5;Mixit_N;4+lang;Vecu_etra_N;development centre economy cradle of the modern world power
2541;PRT;LIS;BUS;F;Inc1;EduF1;EduM1;(1) Loc;Nb_Vis_1a4;Mixit_N;2lang;Vecu_etra_N;free circulation single coin homogenization of identities  
2542;PRT;LIS;BUS;F;Inc3;EduF1;EduM1;(5) Glo;Nb_Vis_1a4;Mixit_N;3lang;Vecu_etra_N;union freedom nation without borders 
2543;PRT;LIS;BUS;M;Inc2;EduF3;EduM4;(1) Loc;Nb_Vis5;Mixit_O;3lang;Vecu_etra_N;developed democratic supportive  
